{
  "architecture": "B200",
  "ref": {
    "calibration_id": "b200-m1-baseline",
    "hardware_id": "b200",
    "schema_version": 1
  },
  "schema_version": 1,
  "static_resources": [
    {
      "capacity_units": 16,
      "description": "mbarrier slot capacity",
      "provenance": {
        "conditions": "sm_100, one resident CTA; catalog policy cap of 16 shared-memory mbarrier objects, not a hardware maximum; capacity is an M1 scheduling bound",
        "origin": "conservative",
        "source": "https://docs.nvidia.com/cuda/parallel-thread-execution/index.html#parallel-synchronization-and-communication-instructions-mbarrier"
      },
      "resource_id": "b200.mbarrier_slots",
      "unit": "slots"
    },
    {
      "capacity_units": 65536,
      "description": "32-bit register capacity",
      "provenance": {
        "conditions": "compute capability 10.x; 64K 32-bit registers per thread block",
        "origin": "vendor",
        "source": "https://docs.nvidia.com/cuda/archive/12.8.1/cuda-c-programming-guide/index.html#features-and-technical-specifications-technical-specifications-per-compute-capability"
      },
      "resource_id": "b200.registers_32bit",
      "unit": "registers_32bit"
    },
    {
      "capacity_units": 232448,
      "description": "shared memory bytes",
      "provenance": {
        "conditions": "sm_100; 227 KiB opt-in maximum shared memory addressable by one CTA",
        "origin": "vendor",
        "source": "https://docs.nvidia.com/cuda/blackwell-tuning-guide/index.html#unified-shared-memory-l1-texture-cache"
      },
      "resource_id": "b200.smem_bytes",
      "unit": "bytes"
    },
    {
      "capacity_units": 262144,
      "description": "tensor memory bytes",
      "provenance": {
        "conditions": "sm_100a/sm_100f; 512 columns * 128 lanes * 32 bits per cell for one CTA",
        "origin": "derived",
        "source": "https://docs.nvidia.com/cuda/parallel-thread-execution/index.html#tensor-memory"
      },
      "resource_id": "b200.tmem_bytes",
      "unit": "bytes"
    },
    {
      "capacity_units": 32,
      "description": "CTA warp capacity",
      "provenance": {
        "conditions": "compute capability 10.x; 1024 threads per block / 32 threads per warp",
        "origin": "derived",
        "source": "https://docs.nvidia.com/cuda/archive/12.8.1/cuda-c-programming-guide/index.html#features-and-technical-specifications-technical-specifications-per-compute-capability"
      },
      "resource_id": "b200.warps",
      "unit": "warps"
    }
  ],
  "supported_dtypes": [
    "bf16",
    "fp16",
    "fp32",
    "fp8_e4m3",
    "fp8_e5m2"
  ],
  "supported_implementation_ids": [],
  "temporal_resources": [
    {
      "capacity_slots": 1,
      "description": "CUDA-core issue engine",
      "provenance": {
        "conditions": "sm_100, one resident CTA; CUDA-core issue serialization; capacity is an M1 scheduling bound",
        "origin": "conservative",
        "source": "https://docs.nvidia.com/cuda/archive/12.8.1/cuda-c-programming-guide/index.html#features-and-technical-specifications-technical-specifications-per-compute-capability"
      },
      "resource_id": "b200.cuda_core"
    },
    {
      "capacity_slots": 1,
      "description": "global-memory read path",
      "provenance": {
        "conditions": "sm_100, one resident CTA; global-read path serialization; capacity is an M1 scheduling bound",
        "origin": "conservative",
        "source": "https://docs.nvidia.com/cuda/archive/12.8.1/cuda-c-programming-guide/index.html#features-and-technical-specifications-technical-specifications-per-compute-capability"
      },
      "resource_id": "b200.gmem_read"
    },
    {
      "capacity_slots": 1,
      "description": "global-memory write path",
      "provenance": {
        "conditions": "sm_100, one resident CTA; global-write path serialization; capacity is an M1 scheduling bound",
        "origin": "conservative",
        "source": "https://docs.nvidia.com/cuda/archive/12.8.1/cuda-c-programming-guide/index.html#features-and-technical-specifications-technical-specifications-per-compute-capability"
      },
      "resource_id": "b200.gmem_write"
    },
    {
      "capacity_slots": 1,
      "description": "register-file read path",
      "provenance": {
        "conditions": "sm_100, one resident CTA; register-read path serialization; capacity is an M1 scheduling bound",
        "origin": "conservative",
        "source": "https://docs.nvidia.com/cuda/archive/12.8.1/cuda-c-programming-guide/index.html#features-and-technical-specifications-technical-specifications-per-compute-capability"
      },
      "resource_id": "b200.rf_read"
    },
    {
      "capacity_slots": 1,
      "description": "register-file write path",
      "provenance": {
        "conditions": "sm_100, one resident CTA; register-write path serialization; capacity is an M1 scheduling bound",
        "origin": "conservative",
        "source": "https://docs.nvidia.com/cuda/archive/12.8.1/cuda-c-programming-guide/index.html#features-and-technical-specifications-technical-specifications-per-compute-capability"
      },
      "resource_id": "b200.rf_write"
    },
    {
      "capacity_slots": 1,
      "description": "shared-memory read path",
      "provenance": {
        "conditions": "sm_100, one resident CTA; shared-read path serialization; capacity is an M1 scheduling bound",
        "origin": "conservative",
        "source": "https://docs.nvidia.com/cuda/blackwell-tuning-guide/index.html#unified-shared-memory-l1-texture-cache"
      },
      "resource_id": "b200.smem_read"
    },
    {
      "capacity_slots": 1,
      "description": "shared-memory write path",
      "provenance": {
        "conditions": "sm_100, one resident CTA; shared-write path serialization; capacity is an M1 scheduling bound",
        "origin": "conservative",
        "source": "https://docs.nvidia.com/cuda/blackwell-tuning-guide/index.html#unified-shared-memory-l1-texture-cache"
      },
      "resource_id": "b200.smem_write"
    },
    {
      "capacity_slots": 1,
      "description": "tensor-core issue engine",
      "provenance": {
        "conditions": "sm_100a/sm_100f, one resident CTA; tcgen05 issue serialization; capacity is an M1 scheduling bound",
        "origin": "conservative",
        "source": "https://docs.nvidia.com/cuda/parallel-thread-execution/index.html#tensorcore-5th-generation-instructions"
      },
      "resource_id": "b200.tensor_core"
    },
    {
      "capacity_slots": 1,
      "description": "in-flight tensor-core operation slots",
      "provenance": {
        "conditions": "sm_100a/sm_100f, one resident CTA; catalog restricts tensor-core concurrency to one tcgen05 operation; capacity is an M1 scheduling bound",
        "origin": "conservative",
        "source": "https://docs.nvidia.com/cuda/parallel-thread-execution/index.html#tensorcore-5th-generation-instructions"
      },
      "resource_id": "b200.tensor_inflight"
    },
    {
      "capacity_slots": 1,
      "description": "TMA issue engine",
      "provenance": {
        "conditions": "sm_100, one resident CTA; TMA issue serialization; capacity is an M1 scheduling bound",
        "origin": "conservative",
        "source": "https://docs.nvidia.com/cuda/parallel-thread-execution/index.html#data-movement-and-conversion-instructions-bulk-copy"
      },
      "resource_id": "b200.tma"
    },
    {
      "capacity_slots": 1,
      "description": "in-flight TMA transaction slots",
      "provenance": {
        "conditions": "sm_100, one resident CTA; catalog restricts TMA concurrency to one transaction; capacity is an M1 scheduling bound",
        "origin": "conservative",
        "source": "https://docs.nvidia.com/cuda/parallel-thread-execution/index.html#data-movement-and-conversion-instructions-bulk-copy"
      },
      "resource_id": "b200.tma_inflight"
    },
    {
      "capacity_slots": 1,
      "description": "tensor-memory read path",
      "provenance": {
        "conditions": "sm_100a/sm_100f, one resident CTA; tensor-memory read serialization; capacity is an M1 scheduling bound",
        "origin": "conservative",
        "source": "https://docs.nvidia.com/cuda/parallel-thread-execution/index.html#tensor-memory"
      },
      "resource_id": "b200.tmem_read"
    },
    {
      "capacity_slots": 1,
      "description": "tensor-memory write path",
      "provenance": {
        "conditions": "sm_100a/sm_100f, one resident CTA; tensor-memory write serialization; capacity is an M1 scheduling bound",
        "origin": "conservative",
        "source": "https://docs.nvidia.com/cuda/parallel-thread-execution/index.html#tensor-memory"
      },
      "resource_id": "b200.tmem_write"
    },
    {
      "capacity_slots": 1,
      "description": "warp issue pipe",
      "provenance": {
        "conditions": "sm_100, one resident CTA; warp issue serialization; capacity is an M1 scheduling bound",
        "origin": "conservative",
        "source": "https://docs.nvidia.com/cuda/archive/12.8.1/cuda-c-programming-guide/index.html#features-and-technical-specifications-technical-specifications-per-compute-capability"
      },
      "resource_id": "b200.warp_issue"
    }
  ]
}
